{
  "change": "module-2d",
  "generated_at": "2026-07-03T18:45:00+03:00",
  "requirements": [
    {
      "id": "FR-MODULE2D-01",
      "pdr_section": "PDR §2D module (L154)",
      "implemented": true,
      "tested": true,
      "spec_compliant": true,
      "evidence": [
        "lib/calculations.ts:254-257 (suggestModule2D(rooms) folds gcd across every room's length & width via reduce((acc,room)=>gcd(gcd(acc,room.length),room.width),0) then suggestionFromGcd(rawGcd) — returns the ModuleSuggestion shape { rawGcd, suggested, alternatives, residual })",
        "lib/calculations.ts:231-238 (suggestionFromGcd: suggested = nearestStandardModule(rawGcd), residual = |rawGcd − suggested| always surfaced, alternatives = two nearest other standard modules — shared with suggestModule so the 2D and 3D paths cannot drift)",
        "lib/calculations.ts:221-224 (RoomDimensions { length, width } — a structural subset of Room, keeping the engine app-state-free / NFR-PURE-01)",
        "lib/calculations.ts:21 (STANDARD_MODULES = [100,150,200,300,350,600,700])",
        "lib/calculations.test.ts::\"suggestModule2D: single room → gcd(length, width)\" (gcd(4200,3500)=700 → suggested 700, residual 0)",
        "lib/calculations.test.ts::\"suggestModule2D: folds the GCD across every room’s length & width\" (three rooms 4200×3500 / 3800×2500 / 2150×1500 → rawGcd 50, suggested 100, residual 50)",
        "lib/calculations.test.ts::\"suggestModule2D: fold is order-independent (GCD associativity)\" (reordered + swapped length/width rooms fold to the identical rawGcd)",
        "lib/calculations.test.ts::\"suggestModule2D: non-standard GCD snaps to a standard module, residual surfaced\" (gcd 1250 → suggested ∈ STANDARD_MODULES, suggested ≠ rawGcd, residual > 0)",
        "lib/calculations.test.ts::\"suggestModule2D: empty list folds to rawGcd 0, snaps to smallest module (residual surfaced)\" (rawGcd 0 → suggested 100, residual 100)",
        "openspec/changes/module-2d/specs/module-2d/spec.md (Requirement: Suggest a module from room dimensions; Scenarios: Single room / Fold across multiple rooms / Snapped value is a standard module, never the raw GCD)"
      ],
      "notes": "FULLY AUTOMATED — this is a pure engine extension (no UI, no i18n, no state), so every clause of FR-MODULE2D-01 is pinned by unit tests, not a manual step. The GCD fold is proven correct three ways: single room = gcd(length,width) (700), the six-dimension three-room fold = rawGcd 50 → suggested 100 / residual 50 (matches the spec Fold scenario), and order-independence (swap/reorder rooms → identical rawGcd, GCD associativity). Snapping is proven a member of STANDARD_MODULES with a non-zero residual for a non-standard GCD (1250→700, residual 550), and the degenerate empty-list case folds honestly to rawGcd 0 → suggested 100 / residual 100 with no `|| 100` magic (ADR-0002 honesty, UI-gated ≥1 valid room). suggestionFromGcd was extracted verbatim from suggestModule (behaviour-preserving lift, DRY) — the pre-existing change-1 suggestModule tests still pass (82/82), so no requirement regression and 'Modified Capabilities: none' is correct. spec-compliance-auditor strict PASS, all 3 reviewers clean / 0 findings."
    },
    {
      "id": "FR-MODULE2D-02",
      "pdr_section": "PDR §2D module (L155)",
      "implemented": true,
      "tested": true,
      "spec_compliant": true,
      "evidence": [
        "lib/calculations.ts:231-237 (suggested = nearestStandardModule(rawGcd) is ALWAYS a STANDARD_MODULES member; rawGcd is carried separately as the traceability input, never returned as `suggested` — the data-contract guarantee behind 'default to suggested, never the raw GCD')",
        "lib/calculations.ts:254-257 (suggestModule2D returns suggested distinct from rawGcd; the value the UI defaults the active module to is `suggested`)",
        "lib/calculations.test.ts::\"suggestModule2D: non-standard GCD snaps to a standard module, residual surfaced\" (asserts suggested ∈ STANDARD_MODULES and suggested ≠ rawGcd — pins the 'suggested is always a standard module, never the raw GCD' contract)",
        "lib/calculations.test.ts::\"suggestModule2D: empty list folds to rawGcd 0, snaps to smallest module (residual surfaced)\" (even the degenerate case yields a standard suggested 100, never rawGcd 0)",
        "lib/calculations.test.ts::\"suggestModule2D: single room → gcd(length, width)\" (suggested 700 ∈ STANDARD_MODULES)",
        "openspec/changes/module-2d/specs/module-2d/spec.md (Requirement: Active module in 2D mode is user-selectable, never the raw GCD; Scenarios: Default is the snapped suggestion, not the GCD / Suggested is always a standard module)"
      ],
      "notes": "SPLIT REQUIREMENT — recorded truthfully. FR-MODULE2D-02 has two halves: (1) the DATA CONTRACT — `suggested` is always a STANDARD_MODULES value and the default active module is `suggested`, never rawGcd — is delivered AND tested HERE (the 'non-standard GCD snaps to a standard module' test pins suggested ∈ STANDARD_MODULES ∧ suggested ≠ rawGcd; the empty-list and single-room tests confirm suggested is always standard). (2) the ACTIVE-MODULE SELECTION + 2D/3D MODE WIRING — the user-selectable active module that actually DRIVES golden split, grid fit, and the 2D visualizer — is honestly DEFERRED to mode-toggle (change 13), matching CAPABILITIES card #12 and the dependency graph. This change is a pure engine only (diff confined to lib/calculations.ts + test, no UI/state), so the wiring cannot exist here yet. implemented/tested/spec_compliant are marked true for the delivered data-contract scope; the traceability-matrix row is `partial` to flag the wiring as materially owned/completed by change 13. spec-compliance-auditor strict PASS and all 3 reviewers judged the deferral correctly scoped (0 findings)."
    }
  ],
  "summary": {
    "total": 2,
    "implemented": 2,
    "tested": 2,
    "spec_compliant": 2
  }
}
